{
  "blind_fields_removed": [
    "category",
    "expected_*",
    "gold_*",
    "label_rationale",
    "predictions",
    "verifier_outputs"
  ],
  "case_count": 22,
  "cases": [
    {
      "answer": "LanceDB full-text search supports filtering with pre-filtering and post-filtering using where syntax.",
      "citations": [
        {
          "claim": "LanceDB full-text search supports filtering with pre-filtering and post-filtering using where syntax.",
          "source_id": "lancedb_vector_search"
        }
      ],
      "contexts": [
        {
          "id": "lancedb_full_text_search",
          "metadata": {
            "authority": "canonical",
            "canonical": true,
            "date": "2026-07-03",
            "freshness": "current",
            "requires_abstention": false,
            "source_authority": "official",
            "source_status": "current",
            "version": "public-page-snapshot"
          },
          "text": "LanceDB full text search supports filtering search results by a condition. Both pre-filtering and post-filtering are supported using where syntax.",
          "url": "https://docs.lancedb.com/search/full-text-search"
        },
        {
          "id": "lancedb_vector_search",
          "metadata": {
            "authority": "canonical",
            "canonical": true,
            "date": "2026-07-03",
            "freshness": "current",
            "requires_abstention": false,
            "source_authority": "official",
            "source_status": "current",
            "version": "public-page-snapshot"
          },
          "text": "Use postfiltering to prioritize vector similarity by searching the full dataset first, then applying metadata filters to the top results.",
          "url": "https://docs.lancedb.com/search/vector-search"
        }
      ],
      "excluded_from_untouched_test": true,
      "pilot_case_id": "ctu1_pilot_001",
      "query": "Can LanceDB full-text search use filters?",
      "source_family": "docs.lancedb.com",
      "source_kind": "previously_exposed_development_case",
      "split": "excluded_calibration_pilot"
    },
    {
      "answer": "DSPy offers algorithms for optimizing prompts and weights. It provisions Kubernetes load balancers.",
      "citations": [],
      "contexts": [
        {
          "id": "dspy_github_overview",
          "metadata": {
            "authority": "canonical",
            "canonical": true,
            "date": "2026-07-03",
            "freshness": "current",
            "requires_abstention": false,
            "source_authority": "official",
            "source_status": "current",
            "version": "public-page-snapshot"
          },
          "text": "DSPy offers algorithms for optimizing prompts and weights for modular AI systems.",
          "url": "https://github.com/stanfordnlp/dspy"
        }
      ],
      "excluded_from_untouched_test": true,
      "pilot_case_id": "ctu1_pilot_002",
      "query": "What can DSPy optimize?",
      "source_family": "github.com",
      "source_kind": "previously_exposed_development_case",
      "split": "excluded_calibration_pilot"
    },
    {
      "answer": "\"\"\n        Utility for providing the files and page numbers for the information used in RAG answers. limit(N_results))\n        return  [RagSearchResult(**r) for r in results.to_list()]\n\ndef get_sources(self, results: List[RagSearchResult]) -> List[str]:\n        \"\"\"\n        Utility for providing the files and page numbers for the information used in RAG answers. MANTIC_DB_PATH\")\nllm_model = os.getenv(\"LLM_MODEL\")\nllm_generate_url = os.getenv(\"LLM_GENERATE_URL\")\n\nsemantic_db = SemanticDb(\n    embedding_function=vecs.get_embeddings,\n    vec_dimension=vecs.dimensions,\n    semantic_db_path=semantic_db_path\n)\n\ndef run_agent(\n    messages: List[Message],\n    table_name=\"semantic-db-table\"\n    ) -> ContentStream:\n    \"\"\"\n    Answers a user query with retrieval augmented generation (RAG) over documents in a LanceDB table in S3.",
      "citations": [],
      "contexts": [
        {
          "id": "local_rag_chat:backend/app/semantic_db/semantic_db.py:12",
          "metadata": {
            "project": "HeskethGD/local-rag-chat",
            "repo_url": "https://github.com/HeskethGD/local-rag-chat",
            "retrieval_score": 0.515,
            "retriever": "sentence-transformers lexical-prefilter cosine",
            "source": "backend/app/semantic_db/semantic_db.py"
          },
          "text": "\"\"\n        Utility for providing the files and page numbers for the information used in RAG answers.\n\nArgs\n        - results (List[RagSearchResult]): The search results from the vector database query.\n\nexcept Exception as e:\n            print(\"error fetching sources\", e)\n            return []"
        },
        {
          "id": "local_rag_chat:backend/app/semantic_db/semantic_db.py:9",
          "metadata": {
            "project": "HeskethGD/local-rag-chat",
            "repo_url": "https://github.com/HeskethGD/local-rag-chat",
            "retrieval_score": 0.4364,
            "retriever": "sentence-transformers lexical-prefilter cosine",
            "source": "backend/app/semantic_db/semantic_db.py"
          },
          "text": "in the vector db to query.\n        - N_results (int): The limit for the number of returned results.\n\nReturn\n        - search_results (List[RagSearchResult]): The semantic search results.\n        \"\"\"\n        results = (lancedb\n                .connect(self.semantic_db_path)\n                .open_table(table_name)\n                .search(query_vector)\n                .limit(N_results))\n        return  [RagSearchResult(**r) for r in results.to_list()]\n\ndef get_sources(self, results: List[RagSearchResult]) -> List[str]:\n        \"\"\"\n        Utility for providing the files and page numbers for the information used in RAG answers."
        },
        {
          "id": "local_rag_chat:backend/app/agents/rag.py:2",
          "metadata": {
            "project": "HeskethGD/local-rag-chat",
            "repo_url": "https://github.com/HeskethGD/local-rag-chat",
            "retrieval_score": 0.3324,
            "retriever": "sentence-transformers lexical-prefilter cosine",
            "source": "backend/app/agents/rag.py"
          },
          "text": "MANTIC_DB_PATH\")\nllm_model = os.getenv(\"LLM_MODEL\")\nllm_generate_url = os.getenv(\"LLM_GENERATE_URL\")\n\nsemantic_db = SemanticDb(\n    embedding_function=vecs.get_embeddings,\n    vec_dimension=vecs.dimensions,\n    semantic_db_path=semantic_db_path\n)\n\ndef run_agent(\n    messages: List[Message],\n    table_name=\"semantic-db-table\"\n    ) -> ContentStream:\n    \"\"\"\n    Answers a user query with retrieval augmented generation (RAG) over documents in a LanceDB table in S3.\n\nArgs\n    - messages (List[Message]): The chat history as messages.\n    - table_name (str): The name of the table in the semantic database.\n\nYields\n    - (ContentStream): The stream response from the LLM.\n    \"\"\""
        }
      ],
      "excluded_from_untouched_test": true,
      "pilot_case_id": "ctu1_pilot_003",
      "query": "How does the RAG agent use retrieved sources when drafting an answer?",
      "source_family": "HeskethGD/local-rag-chat",
      "source_kind": "previously_exposed_real_rag_trace",
      "split": "excluded_calibration_pilot"
    },
    {
      "answer": "A Haystack Document Store has the run method.",
      "citations": [],
      "contexts": [
        {
          "id": "haystack_document_store",
          "metadata": {
            "authority": "canonical",
            "canonical": true,
            "date": "2026-07-03",
            "freshness": "current",
            "requires_abstention": false,
            "source_authority": "official",
            "source_status": "current",
            "version": "public-page-snapshot"
          },
          "text": "In Haystack, a Document Store is different from a component, as it does not have the run method.",
          "url": "https://docs.haystack.deepset.ai/docs/document-store"
        }
      ],
      "excluded_from_untouched_test": true,
      "pilot_case_id": "ctu1_pilot_004",
      "query": "Does a Haystack Document Store have the run method?",
      "source_family": "docs.haystack.deepset.ai",
      "source_kind": "previously_exposed_development_case",
      "split": "excluded_calibration_pilot"
    },
    {
      "answer": "Phoenix datasets contain examples with inputs and optional reference outputs.",
      "citations": [
        {
          "claim": "Phoenix datasets contain examples with inputs and optional reference outputs.",
          "source_id": "phoenix_tracing"
        }
      ],
      "contexts": [
        {
          "id": "phoenix_datasets",
          "metadata": {
            "authority": "canonical",
            "canonical": true,
            "date": "2026-07-03",
            "freshness": "current",
            "requires_abstention": false,
            "source_authority": "official",
            "source_status": "current",
            "version": "public-page-snapshot"
          },
          "text": "Datasets are collections of examples that provide the inputs and, optionally, expected reference outputs for assessing your application.",
          "url": "https://arize.com/docs/phoenix/datasets-and-experiments/overview-datasets"
        },
        {
          "id": "phoenix_tracing",
          "metadata": {
            "authority": "canonical",
            "canonical": true,
            "date": "2026-07-03",
            "freshness": "current",
            "requires_abstention": false,
            "source_authority": "official",
            "source_status": "current",
            "version": "public-page-snapshot"
          },
          "text": "A trace captures model calls, retrieval, tool use, and custom logic so you can debug behavior and understand where time is spent.",